{"id": 0, "commit": "baseline", "hypothesis": "GloballyConsistentStrategy d=0.95 m=2.0 as-is", "primary": {"blind_composite": 0.7186, "blind_pra": 0.972, "blind_gap": -0.582, "blind_mono": 1.0, "blind_min_pra": 0.878}, "guard": {"normal_composite": 1.0, "normal_pra": 1.0, "normal_min_pra": 1.0}, "status": "baseline", "lines_delta": 0, "duration_s": 8.9}
{"id": 1, "commit": "1cd53e1", "hypothesis": "Remove is_success branching to make label-blind", "primary": {"blind_composite": 0.6918, "blind_pra": 0.992, "blind_gap": 0.009, "blind_mono": 0.32, "blind_min_pra": 0.978}, "guard": {"normal_composite": 0.6918}, "status": "discard", "lines_delta": -20, "duration_s": 9.0, "reason": "monotonicity collapsed 100%->32%, blind composite regressed 0.7186->0.6918"}
{"id": 2, "commit": "5ddd675", "hypothesis": "Per-bin LogisticRegression classifiers for stronger blind-mode discrimination", "primary": {"blind_composite": 0.7874, "blind_pra": 0.985, "blind_gap": 0.332, "blind_mono": 1.0, "blind_min_pra": 0.908}, "guard": {"normal_composite": 0.9975}, "status": "keep", "lines_delta": 10, "duration_s": 11.4}
{"id": 3, "commit": "1965205", "hypothesis": "Velocity+acceleration features for classifier", "primary": {"blind_composite": 0.8034, "blind_pra": 0.988, "blind_gap": 0.451, "blind_mono": 1.0, "blind_min_pra": 0.908}, "guard": {"normal_composite": 0.9985}, "status": "keep", "lines_delta": 13, "duration_s": 11.4}
{"id": 4, "commit": "ace7857", "hypothesis": "HistGradientBoosting for non-linear decision boundary", "primary": {"blind_composite": 0.9900, "blind_pra": 0.994, "blind_gap": 3.332, "blind_mono": 1.0, "blind_min_pra": 0.950}, "guard": {"normal_composite": 1.0}, "status": "keep", "lines_delta": 4, "duration_s": 45.7}
{"id": 5, "commit": "d1d1eda", "hypothesis": "Reduce n_time_bins 15->10 for better generalization on short episodes", "primary": {"blind_composite": 0.9980, "blind_pra": 0.999, "blind_gap": 3.259, "blind_mono": 1.0, "blind_min_pra": 0.990}, "guard": {"normal_composite": 1.0}, "status": "keep", "lines_delta": 1, "duration_s": 17.4}
{"id": 6, "commit": "22ce78e", "hypothesis": "Deeper trees (max_iter=100, max_depth=6, lr=0.05, min_leaf=3)", "primary": {"blind_composite": 1.0, "blind_pra": 1.0, "blind_gap": 3.794, "blind_mono": 1.0, "blind_min_pra": 1.0}, "guard": {"normal_composite": 1.0}, "status": "keep", "lines_delta": 1, "duration_s": 79.8}
{"id": 7, "commit": "59596eb", "hypothesis": "Remove bin_stats, use classifier probability only", "primary": {"blind_composite": 1.0, "blind_pra": 1.0, "blind_gap": 4.561, "blind_mono": 1.0, "blind_min_pra": 1.0}, "guard": {"normal_composite": 1.0}, "status": "keep", "lines_delta": -19, "duration_s": 70.3}
{"id": 8, "commit": "none", "hypothesis": "Remove is_success branching entirely for simpler code", "primary": {"blind_composite": 0.9916, "blind_pra": 1.0, "blind_gap": 5.560, "blind_mono": 0.94, "blind_min_pra": 1.0}, "guard": {"normal_composite": 0.9916}, "status": "discard", "lines_delta": -15, "duration_s": 74.1, "reason": "monotonicity dropped 100% -> 94%; maximum.accumulate needed for guaranteed monotonic success rewards"}
{"id": 9, "commit": "6d2213b", "hypothesis": "Cumulative mean replaces is_success branching — label-free monotonicity", "primary": {"composite": 0.9912, "pra": 1.0, "step_auc": 1.0, "mono": 0.99, "coherence": 0.954, "gap": 5.43}, "guard": {"min_pra": 1.0}, "status": "keep", "lines_delta": -15, "duration_s": 94}
{"id": 10, "commit": "580d318", "hypothesis": "Add relative_time feature + smooth_window=15", "primary": {"composite": 0.9943, "pra": 1.0, "step_auc": 1.0, "mono": 1.0, "coherence": 0.962, "gap": 5.38}, "guard": {"min_pra": 1.0}, "status": "keep", "lines_delta": 3, "duration_s": 64}
{"id": 11, "commit": "3ed45cf", "hypothesis": "EMA smoothing of classifier output for fail coherence", "primary": {"composite": 0.9948, "pra": 1.0, "step_auc": 1.0, "mono": 1.0, "coherence": 0.965, "gap": 5.38}, "guard": {"min_pra": 1.0}, "status": "keep", "lines_delta": 7, "duration_s": 52}
{"id": 12, "commit": "5082a48", "hypothesis": "Single global classifier (anti-overfit)", "primary": {"composite": 0.9664, "pra": 0.997, "step_auc": 0.975, "mono": 0.98, "coherence": 0.954, "gap": 2.83}, "status": "keep", "lines_delta": -19}
{"id": 13, "commit": "7a26b20", "hypothesis": "Tune HGBC depth=4 l2=5.0", "primary": {"composite": 0.9744, "pra": 0.998, "step_auc": 0.980, "mono": 0.96, "coherence": 0.957, "gap": 3.14}, "status": "keep", "lines_delta": 0}
{"id": 14, "commit": "c4f5d04", "hypothesis": "Blend classifier + Mahalanobis 50/50", "primary": {"composite": 0.8413}, "status": "discard"}
{"id": 15, "commit": "f7ab863", "hypothesis": "Simplify reward to cm*(0.7+0.3*t/T)", "primary": {"composite": 0.9697, "pra": 0.997, "step_auc": 0.979, "mono": 0.99, "coherence": 0.965, "gap": 2.71}, "status": "keep", "lines_delta": -12}
{"id": 16, "commit": "b318bca", "hypothesis": "Add cumulative displacement feature", "primary": {"composite": 0.9732, "pra": 0.998, "step_auc": 0.981, "mono": 0.99, "coherence": 0.965, "gap": 2.76}, "status": "keep", "lines_delta": 6}
{"id": 17, "commit": "6d70192", "hypothesis": "Linearly-weighted cumulative mean for recency bias", "primary": {"composite": 0.9798, "pra": 0.998, "step_auc": 0.981, "mono": 0.99, "coherence": 0.962, "gap": 2.96}, "status": "keep", "lines_delta": 2}
